sentence,a1,a2,a3
"I don't know anyone who buys Apple products to ""look cool.""",Anecdote,Anecdote,Anecdote
At work I use a Dell desktop that probably cost a couple hundred dollars.,Anecdote,Anecdote,Anecdote
"At home I have a $1,500 MacBook Air with a solid state hard drive.",Anecdote,Anecdote,Continue
My MacBook is *always* faster and more reliable than my work computer and my friends with android phones are constantly complaining about them while my iPhones have always been problem free until they get old (and I'm not exactly gentle with my phones).,Anecdote,Continue,Continue
I think both product lines probably have their pluses and minuses.,Assumption,Assumption,Assumption
But I believe most Apple users are knowledgeable consumers who know exactly what they want and what they're getting.,Assumption,Assumption,Continue
"I don't use apple products exclusively, but I have owned macbooks, ipads, and ipods (never an iphone though) and the reason that I buy apple products and the reason I recommend them to people who need new computers or phones is for one simple reason: consistency.",Anecdote,Anecdote,Anecdote
"Apple has a limited, easy to understand line of products that just work.",Assumption,Assumption,Continue
They work well and they work for a substantial amount of time compared to many similar devices.,Assumption,Continue,Continue
And part of that is because Apple maintains full control over their hardware and software.,Assumption,Continue,Continue
Not all android phones work as well as one another.,Assumption,Assumption,Assumption
But all iPhones work pretty much as well as any other iPhone.,Assumption,Continue,Continue
Maybe with a couple more bells and whistles on the latest version.,Assumption,Continue,Continue
But my 4 year old iPad runs just as well as my wife's 1 year old iPad mini and I haven't found an android tablet manufacturer that has come close to that kind of consistency.,Anecdote,Anecdote,Anecdote
And consistency in a brand and in a device is something that I am more than willing to pay a little extra for.,Assumption,Continue,Continue
"For the majority of people, who just want something that works and don't want to worry about spec sheets and want a bunch of devices that work with each other well out of the box with little to no setup, Apple is more than worth the convenience and peace of mind.",Assumption,Assumption,Assumption
"I really think you are being somewhat unfair here:

&gt; AND requiring the user to purchase a separate lightning-to-3.5mm adapter that costs $10 and is described as ""fragile"" and ""poorly made"".",Assumption,Statistics/Study,None
They give it to you ~~for free~~ _at no additional charge_ in the box when you purchase the phone.,Continue,Continue,Assumption
"&gt;Mac OS is exclusive to Apple products, which forces me to pick up one of their $2000+ Macbooks if I want to even touch their operating system.",Assumption,Assumption,None
You can buy a Mac Mini for $499 on the website (not to mention the number of used offerings out there.,Assumption,Statistics/Study,Anecdote
I got a couple year old MM for $150 on Ebay).,Anecdote,Anecdote,Continue
They don't sell the OS - they haven't for years.,Assumption,Common ground,Assumption
They give it away ~~for free~~ _at no additional charge_ with their hardware.,Assumption,Common ground,Continue
Want to add some songs to your iPhone?,Assumption,Other,None
Better open up iTunes!,Continue,Continue,None
"Which they give away ~~for free~~ _at no additional charge_

&gt;Need a new cable?",Assumption,Continue,None
Time to go the Apple Store!,Continue,Continue,None
"Or Amazon, where you can purchase a replacement cable for [$6](https://www.amazon.com/Anker-Lightning-Charging-Charger-Certified/dp/B00K4VQZCM/ref=sr_1_7?ie=UTF8&amp;qid=1506020529&amp;sr=8-7&amp;keywords=lightning+cable)

&gt;The company has done such a great job at establishing their brand image over the last few decades that they can send out overpriced, mediocre products and still make money.",Assumption,Other,None
"While you may not agree with their product and pricing strategy, many people do get value for the products.",Assumption,Assumption,Assumption
That does not make them overpriced or mediocre.,Continue,Continue,Continue
"**Edit** As someone pointed out to me, nothing is really ""free"" - it is all baked into the price of the products.",Definition,Definition,None
"The phrase ""at no additional charge"" is more accurate.",Continue,Continue,None
1.,None,None,None
"Innovation

It's really a catch 22, we want them to try new things but then we get mad when they do ""A prime example is the iPhone 7 and its missing 3.5mm headphone jack"", while i agree it does not seem very practical at least they are trying new things out.",Assumption,Assumption,Assumption
A lot of what we consider essential was though of as weird at first.,Assumption,Continue,Continue
2.,None,None,None
"OS

They really like quality, at the end of the day most programs on MAC have little to no issues when compared to the PC environment.",Assumption,Assumption,Assumption
"This results in much less inventory but higher quality, in order to develop for OS you must do extensive testing and make sure things dont break, while on the PC world it's a lot quicker and easier to push your product out (faulty or not).",Assumption,Assumption,Continue
"While this has advantages/disadvantages, Apple decided it wanted to control the quality of its products, hence the higher requirements to develop both hardware and software for apple.",Assumption,Assumption,Continue
3.,None,None,None
"Own equipment

Back to quality, while there are 20+ brands you can buy for PC, there are limited options for MAC but this has always been the case.",Common ground,Assumption,Assumption
4.,None,None,None
"Quality and pricey

I mean yes, its expensive but i know my dad wont break his iphone software downloading the wrong apps or catch a virus.",Assumption,Anecdote,Assumption
I know the UI is going to be simple and elegant and i am willing to pay more for it.,Assumption,Anecdote,Assumption
Its similar to Mercedez and other brand cars that provide luxury and comfort at an added price,Assumption,Assumption,Anecdote
"Since there are already great response, I'm only going to add that Apple real value is in the details.",Assumption,Assumption,Assumption
"Before I became a software engineer, I used to hate Apple with a passion and have a similar view as yours (which technically is as much a result of marketing from the rest of the industry, that value specs over experience).",Assumption,Anecdote,Anecdote
"Than I learned way more about their engineering design, software integration and user experience.",Testimony,Continue,Continue
Apple is a rare bread of company that can pull off what would take 2 or more company to achieve.,Continue,Assumption,Continue
"Sometimes people think of Apple as this Giant company, but if you consider that they do all this software, hardware and sales on their own, they do it with less human resources than all other products on the market.",Assumption,Assumption,Assumption
"Also after taking courses in the sociology of technology, you come to realize that Apple is doing something very difficult very successfuly.",Testimony,Anecdote,Anecdote
"Making people embrace chance is the most difficult step of a new technology (not developing it, and not manufacturing it).",Continue,Assumption,Assumption
Many great technology achievements were lost by lack of understanding of the human sociology.,Continue,Assumption,Continue
Apple are arguably the best in the world in their industry in the sociology aspect of the technology.,Continue,Assumption,Continue
"It's something that's very overlooked, but so important.",Continue,Assumption,Continue
I agree with all that you say.,None,None,None
However there is one point that you did not mention.,None,None,None
Their build quality really is supreme still.,Assumption,Assumption,Assumption
They have established as a norm a certain build quality that is hard to find elsewhere.,Assumption,Assumption,Continue
I have for example bought 3 y ago an Asus Zenbook for 1000€.,Anecdote,Anecdote,Anecdote
It was superior with regards to components to a Macbook Air of that time and the latter costed double!,Continue,Continue,Continue
"I still think this Zenbook is a great buy for 1000€ but build feels inferior to Mac, despite the fact that it is a very solid machine with no problems or squeaking noises.",Assumption,Continue,Continue
One of their biggest advantages nowadays is their build quality and this is what sells them as well additionally to irrational fan-base.,Assumption,Assumption,Continue
"&gt; Mac OS is exclusive to Apple products, which forces me to pick up one of their $2000+ Macbooks if I want to even touch their operating system.",Assumption,Anecdote,None
This is just factually untrue.,Continue,None,Assumption
"As someone who generally doesn't see the appeal of Apple and has never owned an Apple product, I have to disagree.",Assumption,None,None
"I follow trends in SoCs, CPUs, and other components as well as AR/VR quite closely and see the latest Apple offerings as a technical marvel.",Testimony,Anecdote,Testimony
"People don't understand how many hard problems Apple has solved in computer vision with its AR software because most see it as nothing more than a small feature in a list, but AR is more than a feature, it's the platform for the future and incredibly difficult to pull off given the current state of technology.",Assumption,Assumption,Assumption
"True, Google release ARCore around the same time and other companies like Nvidia and Qualcomm are making big strides in computer vision, but a lot of what Apple did was in house and to a higher standard, and naturally those R&amp;D costs are passed down to consumers in the cost of the phones.",Assumption,Assumption,Anecdote
Just seeing what Apple is able to do by levying computer vision on its camera software is spellbinding.,Assumption,Assumption,Anecdote
"The phones themselves, on a hardware level, may be valued at $2-300 but when you account for everything else that went into it...",Assumption,Statistics/Study,Assumption
I think $1000 or so is reasonable.,Continue,Assumption,Continue
"If you don't see the value or potential in these new features, you really don't need to have the latest model iPhone as any phone from the last three years should suffice.",Assumption,Assumption,Assumption
Apple relies primarily on lock-in to sell its products.,Assumption,Assumption,Assumption
"People will still buy it, not because it's Apple, but because you can't get the software you're locked in to on anything not made by Apple, at least not easily.",Assumption,Continue,Common ground
Apple includes the 3.5mm to lightning adapter in the box of the 7/+ and the 8/+.,Assumption,Common ground,Assumption
I’ve said this before elsewhere but it’s not really apple’s fault that people are careless and lose their things.,Assumption,Assumption,Assumption
You could kinda argue Apple’s intentions in that regard.,Assumption,Continue,None
Maybe they show malice here because they realize that people are careless and will likely have to buy a new adapter.,Assumption,Assumption,Assumption
"Apple, however, has stated on several occasions that their goal is wireless.",Testimony,Anecdote,Continue
"On an anecdotal note, I’ve owned an iPhone 7 since October 2016 and I still have and use my original adapter every day.",Anecdote,Anecdote,Anecdote
I even bought a spare to use at the gym.,Continue,Continue,Continue
"Also, keep in mind, that most people just use the pair of earbuds they got in the box with their phone - which in the case of the iPhone 7/+ and 8/+ is a pair of lightning EarPods.",Assumption,Assumption,Assumption
I also maintain that apple’s cables are built well.,Assumption,Assumption,Anecdote
"Generally speaking, however, people treat the cables like shit.",Assumption,Assumption,Assumption
"Again, not apple’s fault.",Continue,Continue,Continue
"Again, maybe Apple knows that people treat cables like shit so they make a cable that works but needs to be replaced when it’s treated poorly.",Assumption,Assumption,Assumption
I buy Apple cables because I don’t treat mine like shit and I’d rather buy something that definitely isn’t gonna fry my battery - I’m cautious even with MFi certified products.,Anecdote,Anecdote,Anecdote
The compatibility of software and hardware is a double edged sword.,Assumption,Assumption,Assumption
Their software only works on their hardware.,Assumption,Continue,Continue
"But, their software works really damn well on their hardware.",Continue,Continue,Continue
This goes the same for their computers and their mobile devices.,Assumption,Continue,Continue
"CMV: Some people think they're edgy by being part of the stupid Android vs apple tribal war and talking like that about apple, disregarding that all companies are like that/ strive to be like that.",Assumption,None,None
Tribalism is dumb,Assumption,None,None
"I bought a used Cinema Display today (only got it because it was a good deal) but one thing I admire about them is quality, the cool-to-the-touch aluminum body of the screen just blows me away, I'm a cheese for quality construction but I really appreciate Apple for it .",Anecdote,Anecdote,Anecdote
(I know this doesn't really argue anything but just chiming in),None,Continue,None
I have had an iPhone for 5 years.,Anecdote,Anecdote,Anecdote
It still works well and continues to get updates.,Continue,Continue,Continue
I also just love the ergonomics of my macbook which has a very nice touchpad and just works.,Assumption,Continue,Continue
The operating system is still as crisp as the day I bought it.,Anecdote,Continue,Continue
I hate how protectionist they are but the products I feel have a much longer quality of life span.,Assumption,Continue,Continue
"I have heard this argument so many times over the years, and it comes down to the concept that people can be ""fooled"" into thinking that a phone/computer/operating system is good, when another is objectively better.",Assumption,None,Assumption
But the experiences we're taking about aren't objective.,Assumption,Assumption,Continue
They're subjective.,Continue,Continue,Continue
"Your argument is equivalent to ""DC *fooled* people into thinking Wonder Woman was a good movie"".",Assumption,None,Assumption
I saw it.,Anecdote,Anecdote,Anecdote
My eyes saw the images and my ears heard the sounds and I enjoyed it.,Continue,Continue,Continue
It was a good movie *for me*.,Continue,Continue,Continue
Was I fooled or tricked into thinking I liked it?,Continue,Continue,Other
"No, I actually liked it, for whatever that's worth.",Continue,Continue,Continue
"My ticket money was well spent, *for me*.",Continue,Continue,Continue
"Second argument: If fooling people by marketing is so easy, why is Apple the only company who can do it?",Assumption,Other,Other
"If you can see how the trick is done, why haven't *you* started a company which relies on this trick?",Other,Continue,Continue
"First of all who describing the 3.5 to lightning as ""fragile"" and ""poorly made"" other than you?",None,Other,None
There's a two year warranty on them and they will replace as many as you break for free.,Assumption,Common ground,Assumption
"I don't think it's ""deceptive"" to sell a product without a headphone jack.",Assumption,Assumption,Assumption
They literally put it in all their advertisements as a positive.,Continue,Assumption,Continue
I think if anything Apple is the most out in the open about what they do.,Assumption,Assumption,Continue
"And when it comes to software, people are paying for the 5 years of guaranteed updates they get on the iPhone as well as the customer service.",Assumption,Assumption,Assumption
"Basically, there's a reason they're the most profitable company in the world.",Assumption,Continue,Continue
"And it's not because they're ""deceptive"".",Continue,Continue,Continue
It's because they make fantastic products that they stand behind.,Assumption,Assumption,Continue
Sent form my iPhone 7,None,None,None
&gt,None,None,None
I sell phones for a living.,Testimony,Anecdote,Testimony
My job is to ask people how they use their phone so I can sell them the appropriate phone and the accessories.,Continue,Continue,Continue
I'd estimate that less than 25% of iphone users have ever plugged something into their headphone jack.,Statistics/Study,Statistics/Study,Continue
"If apple can remove the headphone jack and add something like even a 5% increase in battery (as that jack is really pretty big as far as components go), that trade off is going to be beneficial to a large majority of their users.",Assumption,Statistics/Study,Assumption
Why wouldn't apple make that tradeoff?,Assumption,Other,Continue
Especially if a large percentage of that 25% are just gonna grumble and buy it anyways?,Assumption,Statistics/Study,Continue
Personally I don't think either of these cases were what I'd call terrorism.,Assumption,Assumption,None
"They were virtually identical in terms of perpetrator, with only the availability of weaponry making 50 more people dead.",Assumption,Assumption,Assumption
Of course they are *technically* terrorist acts but neither perp had any kind of network or clear agenda.,Assumption,Assumption,Continue
"I agree with you that the brexit shooter was a terrorist, because they had a political agenda, just like the Pulse shooter.",Assumption,None,Common ground
"&gt;Where do we draw the line between ""disturbed mental patient"" and ""terrorist""?",Other,None,None
"The line is exactly where it always has been - if they are using fear to push an agenda, they are a terrorist.",Assumption,Definition,Assumption
Roof later confessed that he committed the shooting in hopes of igniting a race war.,Assumption,Anecdote,None
"That means he's technically a terrorist, too, since he is trying to push an anti-black agenda.",Continue,None,Assumption
"However, I feel that as of late the usage of the word 'terrorist' has grown to imply association with a terrorist group.",Definition,None,Assumption
"If the Charleston shooter were a member of the KKK, and the KKK regularly committed acts of terror (they don't actually do that nowadays AFAIK, but it's the closest thing I can come up with), then the media would call him a terrorist too.",Assumption,Assumption,Assumption
Calling what the Pulse shooter did 'Islamic terrorism' is as accurate as calling the Charleston shooter 'racist terrorism'.,Assumption,Assumption,Assumption
The only reason the Charleston shooter isn't labeled a terrorist is because there is no racist anti-black terrorist group with an agenda that he could have claimed to have been pushing.,Assumption,Assumption,Continue
"Basically, you're seeing racism where there isn't any.",Assumption,None,Assumption
"If you can find a group of white people with a codified agenda who are committing violence in the name of that agenda, and yet not being called terrorists, then I will grant you that there is hypocrisy.",Assumption,None,None
"For now, it just so happens that only brown people fall into the category of belonging to an organization that pushes a codified agenda using violence.",Assumption,Assumption,Assumption
You're getting hung up on terminology and it appears you are very reluctant to classify this as an Islamic Extremists who killed gays in the name of Allah just as dozens upon dozens of Islamic Extremists have been doing for decades and very frequently in the last 15 years.,Assumption,Anecdote,Assumption
"I have seen everything that says he was a disgruntled gay, etc.",None,None,Anecdote
I'm not discounting that.,None,None,Continue
But you might ask yourself what is your motivation for asserting this viewpoint?,Other,None,None
Why does this event conjure up an agenda for you?,Other,None,None
"Why does the US government particularly the Obama Administration and FBI feel the need to downplay, ignore, brush off, and even attempt to cover up the notion that this was an Islamic Extremist?",Other,Other,Other
What is their motivation for that?,Continue,Continue,None
"Not a Trump fan, but to borrow his phrase ""something is going on""   
  
The Obama Administration has always been really good at being matter of fact and calling it what it is, except when it comes to Islamic Extremism.",Assumption,Assumption,Assumption
"We can weigh the evidence all day, but you cannot deny that the primary motivation for Omar Mateen's actions were to kill Americans, targeting homosexuals specifically, on behalf of Allah and the IS.",Assumption,Common ground,Assumption
His recent history of homosexuality may have been what lead him to carry out this specific mission.,Continue,Continue,Continue
You must know that it is wrong for a married Muslim to sleep with another woman.,Common ground,Definition,Common ground
But there is no law against sleeping with another man.,Continue,Continue,Continue
"Same goes for premarital sex, dude sex is free game.",Continue,Continue,Continue
"For an act to be considered terrorism, it must have political aims that it hopes to achieve.",Definition,Assumption,Definition
"By swearing allegiance the the Islamic state, you have made a political decision by associating yourself with a terrorist group.",Assumption,Assumption,Assumption
"When as you call them ""white mass shooters"" commit the acts that they do, it is usually a product of mental health issues and has no goal in mind.",Assumption,Assumption,Continue
Npr did a piece on this a while ago in regards to another mass shooting and why they hadn't called it terrorism.,Testimony,Statistics/Study,Anecdote
"As I remember, they claimed they only report something that way when it is classified that way by a government agency.",Continue,Continue,Continue
"In this case the FBI immediately started investigating it as a terrorism case (I suspect the phone call where he said his name was daesh or whatever helped), so I don't think it is the media always to blame on this.",Continue,Continue,Assumption
"&gt;But if we look at the major mass shootings in the U.S in the past few years, we find that almost every single one in recent history was done by a white gunman with no ties to Islam or any terror cells.",Anecdote,Statistics/Study,None
"Where do we draw the line between ""disturbed mental patient"" and ""terrorist""?",Other,None,None
"Terrorism, by definition, is a political act.",Definition,Definition,Definition
Shooting people because the voices told you it would be fun is not.,Continue,None,Assumption
"While all these actions do fit one dictionary definition of terrorism, there are actually two distinct conceptualizations of terrorism in play here that are being equivocated on.",Definition,Definition,Assumption
"On one hand, we have a seemingly one-off events that effect little to no political change.",Continue,Continue,Continue
"On the other, we see a common campaign of terror attacks that have a significant impact above and beyond their immediate victims.",Continue,Continue,Continue
 Nobody wants to acknowledge this white man as a terrorist.,Assumption,Assumption,None
"4 days ago I shared this comment with someone wondering why the reporting has so far been non-commital and seemingly avoiding attaching any strong label to the man who murdered Cox, paraphrased to better suit purposes here as follows:

&gt; Perhaps it would be seen to be adding to an already troubling culture of reporting and fear mongering which seems to have contributed to this womans death.",Assumption,Anecdote,None
"&gt; Perhaps more importantly out of respect, to allow the immediate focus to be on her and her memory as opposed to him and his agenda.",Continue,Other,None
"&gt; Also as another commenter highlights,  we're in the middle of an important referendum which not only affects us but all countries worldwide.",Assumption,Anecdote,None
"&gt; I'm sure analysis will come and specific defining terms will be comitted to and stated later on - most likely after the referendum, so as to avoid being seen to be or in fact be influencing voters on either side.",Continue,Assumption,None
"Not so much a CMV as such, more a hold that thought until after the referendum.",None,None,None
Well obviously someone with the motive of causing terror is a terrorist.,Definition,Definition,Common ground
It's important to differentiate motive here.,Assumption,None,None
"The Columbine killings were a terrorist attack, that was their intention.",Definition,Anecdote,Common ground
Same with Timothy McVeigh and the Oklahoma City bombing or the 1993 trade center bombing.,Continue,Continue,Continue
These acts were done by their perpetrators with the explicit reason being terror.,Continue,Continue,Continue
That recent Christian guy who shot up that planned parenthood clinic intended to cause terror.,Anecdote,Anecdote,Assumption
Those people are terrorists.,Continue,Continue,Continue
Charles Whitman is a good example of a horrible attack without being a terrorist.,Anecdote,Anecdote,Assumption
He was sick with a tumor in his brain and it gave him crazed thoughts that he acted out at the University of Texas.,Continue,Continue,Continue
"He's a horrible person, but not a terrorist.",Continue,Continue,Continue
Most white mass shooters don't have a political aim or motivation they wish to achieve via terror stemming from their violence.,Assumption,Assumption,Assumption
Therefore they generally aren't terrorists.,Continue,Continue,Continue
I'd say Dylan Roof qualifies though.,Anecdote,None,None
This is such an easy answer.,None,None,None
Did they do it for political or religious motivations?,Definition,Definition,Other
"If so, then yes.",Continue,Continue,Continue
"If not, since that is the definition of terrorism, they are not terrorists.",Continue,Continue,Continue
