sentence,a1,a2,a3
It's possible (likely even) that we will also create technology that will allow us to modify human brain to acquire information extremely quickly.,Assumption,Assumption,Assumption
Imagine some kind of brain-computer interface (or a computer augmented brain) which would basically allow you to upload knowledge.,Assumption,Assumption,Assumption
With improvements like that we can keep the rate of growth of knowledge for quite some time.,Continue,Continue,Continue
Layers of abstraction mean that you don't have to learn all of what came before to continue work on the bleeding edge.,Definition,Definition,None
Lady Ada Lovelace had to understand Babbage's Analytical Engine in great detail to write algorithms for it.,Anecdote,Anecdote,Anecdote
Early computer scientists of this century were required to have great electronic and mechanical understanding.,Anecdote,Anecdote,Anecdote
"Now there are people programming in languages like python who don't know how a transistor works, who don't know how CPU instructions work, who don't even have to understand exactly what a compiler is.",Assumption,Continue,Continue
And that understanding isn't required to write complex and useful programs.,Continue,Continue,Continue
computers don't have that limitation.,Assumption,Assumption,None
"Also, do you know how to build a house?",Assumption,None,None
no well we have people that can build skyscrapers.,Continue,Anecdote,None
How about a triplane?,Assumption,None,None
no?,Continue,None,None
well we have people that can build space ships.,Continue,None,None
I mean ships that go into space.,Continue,None,None
It is all about simplification to a learnable point.,Assumption,Assumption,None
As things get better understood they can be simplified down.,Assumption,Continue,Assumption
You don't need to know every thing  about triangles to know about the Pythagorean theorem and to have learned it in a week as a young child.,Assumption,Assumption,Continue
"I think the issue with your argument is that you treat the domain of human knowledge as expanding and building on itself, while the process of acquiring that knowledge as immutable.",Assumption,Assumption,None
Remember that education is a field that is also being actively researched as of late.,Common ground,None,None
Having been through the public education system I would argue that the majority of student time is spent performing useless tasks that ultimately did not contribute to their understanding of some crucial subject matter.,Anecdote,Assumption,Testimony
"Already, the rise of the internet has made a huge difference in dropping the learning curve for some serious subject matter.",Assumption,Assumption,Assumption
"This has made it possible for teenagers to make it to Silicon Valley, and ingenuity to come from unlikely places.",Continue,Anecdote,Continue
"There is still a huge room for advancement in the fields of education, and who knows what kinds of advances will improve this system?",Assumption,Assumption,None
"Currently, the process of becoming an expert in a field who is able to contribute meaningful research to its development requires about 20-25 years of education.",Assumption,Anecdote,Assumption
"Of those, only 5-10 are spent studying material that is directly pertinent to that field.",Continue,Continue,Continue
We can definitely do better in this regard.,Continue,Assumption,Continue
A restructuring of K-12 curriculum to eliminate waste and introduce important emerging fields could be one of the first steps towards this end.,Assumption,Anecdote,Assumption
"Better methods to absorb and retain information could exponentially decrease the amount of time spent learning, and thus completely negate or even reverse the effects you mentioned.",Assumption,Assumption,Continue
"While I can't say for sure which forces will push harder in either direction, you should also consider that knowledge is becoming more easily accessible and the process of accessing that information under critical development.",Assumption,None,None
"I'm not convinced that the sheer amount of ""stuff to know"" is increasing at such a rate as to counteract this.",Assumption,None,Assumption
Meta-studies can succinctly catch you up on the state of the art in a matter of minutes -- you are free to explore new ideas from there and potentially to break new ground,Assumption,Assumption,Assumption
"Hi, that is very interesting question here!",None,None,None
I have wondered about that for so long without confronting it to anyone.,None,None,None
I think the main reason I stopped thinking about it is the following: I think that we can postpone that moment for a very long time.,Assumption,None,Assumption
Too long to make plans on how humans would even work at that moment.,Continue,None,Continue
&gt,None,Assumption,None
Let's say the limit would be reached if a field requiers like 60 years of study to be up to date.,Assumption,Assumption,Assumption
"Nowadays, even when studying several connected subject (e.g : several Quantum physics subjects) , we barely spend 10 year studying it.",Continue,Anecdote,Continue
So i am pretty sure we still have a very long road to getting somewhat near to the limit!,Continue,Assumption,Continue
"If this limit is reached in a few hundred years, imagine how much would changed in the way we learn/think/research.",Assumption,Assumption,Continue
(Cf how much has changed in the last 50 years!),Continue,None,Continue
"Then what would happen would be more related to sience-fiction / imagination:

- Better teaching methods
- Biological enhancement to have memory work better (larger storage and better retrieving)
- Biological enhancement to have brain work faster (and we would improve the efficiency of the drug faster than we get to the limit in the domain of drug optimisation ...)
- Doubled life expectancy 
- Computers designed to inject knowledge into our brains ( ""I know kung fu"" matrix learning style)
- Having (quantum) computers smart enough to do the research themselves.",Assumption,Assumption,Assumption
- Whatever can be imagine if the progress rate is as exponential as the past 50 years!...,Continue,Assumption,None
You are describing disciplines as linear.,Assumption,None,None
What ends up happening is a particular discipline will 'collapse' under its weight and become multiple disciplines.,Continue,Assumption,Assumption
"An engineer isn't a master of all things electrical, software, aeronautical, etc.",Definition,Definition,None
"This is a relatively simple point, but I think it is also worth noting that specialization has a role to play in combating the knowledge overload problem.",Assumption,Assumption,None
Medicine is perhaps the most obvious example of information overload,Anecdote,Assumption,Anecdote
"We've gone from ""Doctors vs. Surgeons"" to separating out even individual fields into subspecialties (like interventional radiologist vs. diagnostic radiologist vs. interventional neuroradiologist).",Assumption,Anecdote,Continue
"I think medicine disciplines are somewhat unique because that knowledge needs to be active knowledge; you can't rely on the internet for near-instantaneous access, you need to know it, confidently, in the moment, so it's a better way of assessing whether individual humans are getting knowledge overload.",Assumption,Assumption,Assumption
"So the solution is not longer and longer training times (although we are seeing that to some degree), but rather more branch points within training, and becoming more specialized.",Assumption,Assumption,Continue
This is obviously enhanced by the fact that the professors themselves are becoming more specialized.,Assumption,Continue,Assumption
"I'm not in academics, but I think that a similar process is likely occurring there; you aren't a chemist any more, you are a quantum chemist or a thermodynamic modeling chemist or a macromolecular organic chemist.",Assumption,Assumption,Continue
"So to answer your broader point, I don't think we are at significant risk of knowledge accumulation slowing down, because this process of specialization can continue essentially ad infintum.",Assumption,Assumption,Assumption
After college/graduate school the rate at which adults learn stuff slows down dramatically.,Assumption,None,None
"A lot of adults at their jobs right now don't really ""learn"" new stuff, they just do their job with stuff they already know.",Assumption,Assumption,None
Imagine if they kept on learning as if they were in school.,Continue,Assumption,Assumption
That's 40years to learn new stuff.,Continue,Continue,Continue
"So maybe there is a limit, but we aren't close to it yet.",Assumption,Assumption,Assumption
"This is going to be fairly simplistic, but useful.",None,None,None
Imagine human knowledge as a circle.,Assumption,None,None
"Previously, humans learned very general things.",Continue,Assumption,Anecdote
You can imagine the total knowledge as a circle with a small radii representing depth and the interior of an arc as the breadth of the individuals knowledge.,Continue,Assumption,Continue
The breadth of knowledge was necessary as food shortages forced any one member into a variety of roles.,Continue,Continue,Continue
"As advancements in food came about, individuals were able to specialize and gain more knowledge in any one field while sacrificing knowledge in other fields.",Continue,Continue,Continue
This can be represented as the circle of human knowledge expanding while the individual's slice becoming smaller.,Continue,Continue,Continue
"As humans become more and more specialized due to a larger and larger food surplus driving population growth, a given individual will be able to continually expand human knowledge, while knowing a lesser breadth.",Continue,Continue,Continue
"So while human knowledge expansion may slow down, the limiting factor is not the knowledge itself but food surplus.",Assumption,Assumption,Continue
"It the rate of human growth slows down, then knowledge expansion will slow down but not until then.",Continue,Assumption,Continue
"For a further analogy to how this works, look at Kepler's law of equal areas: an imaginary line drawn from the center of the sun to the center of the planet will sweep out equal areas in equal intervals of time",Assumption,None,Testimony
There's an issue with the chart: does it specify the age of the winner at the time of the award or at the time of the discovery?,Other,None,None
Often the prize is awarded long after the discovery which will mess with things quite a bit.,Assumption,Assumption,Assumption
And what was the theoretical limit of knowledge that a human can acquire in a lifetime?,Assumption,None,None
235 knowledge units per 27 year span?,Assumption,None,None
"It took humans many, many generations to come up with the concept of 'zero'.",Assumption,Assumption,Anecdote
How long does it take a child to understand the concept?,Assumption,Assumption,Common ground
Clearly not the thousands of years it took to be invented.,Continue,Continue,Common ground
Well one of the main things we should be working on scientifically is extending the human lifespan... and then to improve human intelligence.,Assumption,Assumption,Assumption
So it really becomes a question of can we manage that with our current lifespan.,Continue,Continue,Continue
"Also, sometimes new advance in technology make things simpler or provide useful tools to make tasks easier.",Assumption,Assumption,Assumption
"For example, building virtual models in a computer simulation.",Anecdote,Continue,Continue
"Humans build tools with their knowledge that allow the next generation need only learn how to use the tool, not build it, to continue growth.",Assumption,Assumption,Assumption
"Example; we needed binary to develop computers and code, but now we have code a young person doesn't need to learn binary to contribute - they can learn code instead.",Anecdote,Assumption,Anecdote
"Because of computers, you can post this information online without knowing anything about how it works.",Assumption,None,None
You can use information without having it.,Definition,Assumption,None
That's abstraction.,Continue,Continue,None
All that's required is that we have abstraction.,Assumption,Assumption,None
That's created by individual who have the information and can contribute to abstraction.,Continue,Continue,None
"In the end, very few people understand every single detail of how reddit got online and you posted you CMV.",Assumption,Assumption,Assumption
"We have enough human memory storage to make it happen, though.",Assumption,Assumption,Continue
"As long as we have humans, we'll have the ability to create abstraction.",Assumption,Assumption,Continue
"I'd take it down to the level of cognitive and volitional operations - attending to data, questions, insights, hypotheses, tests, judgements, decisions, etc.",Assumption,Assumption,None
"IMO, the key to overcoming what you are talking about is to develop scientific collaboration into a form where the interfaces/relations between individual scientific operations are performer-independent.",Assumption,Assumption,Assumption
"Relative to the clear framing of a question, it doesn't matter who had the incipient case of wonder, so long as the interface between the one and the other is independent of divisions between this or that human psyche and life cycle.",Assumption,Assumption,Continue
Something like this.,None,None,None
"Relative to the insight, it no longer matters *who* framed the question.",Assumption,Assumption,None
"Relative to the formulation of hypothesis, it doesn't matter who had the insight.",Assumption,Assumption,None
"Relative to the development of tests, it doesn't matter who formulated the hypothesis.",Assumption,Assumption,None
"Relative to the development of tests, it doesn't matter who performs the tests.",Assumption,Assumption,None
"Relative to the interpretation of results, it doesn't matter who performed the tests.",Assumption,Assumption,None
"Relative to a decision about what to do with interpreted results, it doesn't matter who interpreted the results.",Assumption,Assumption,None
etc.,None,None,None
etc.,None,None,None
etc.,None,None,None
"Once operations are differentiated like this and can relate completely irrespective of who performed them, we're there.",Assumption,Assumption,Assumption
Edit: How far will we get?,None,None,None
IDK,None,None,None
"Take the example of computing languages:

All languages are traced back directly to the punch card monoliths of the mid 20th century.",Anecdote,None,Anecdote
"From those original codes we have developed commands that combine commonly used commands into one larger command, then further combined those commands, then again so that now one word in a command line can execute the same functions that an entire stack of cards would have been hard pressed to convey a few generations ago.",Continue,Anecdote,Continue
"It's not just that we advance in understanding, we also learn to set up shortcuts to learning how to gain that practical understanding.",Assumption,Assumption,None
We do this in all areas of technology.,Assumption,Assumption,None
Instead of needing to learn how to wire an entire building we color code the wires and terminals.,Anecdote,Assumption,Anecdote
Instead of needing to know how to create dovetail joints we buy our furniture at IKEA.,Anecdote,Assumption,Continue
We even build machines to find shortcuts for the shortcuts...,Anecdote,None,Continue
So each step forward has a corresponding sidestep that allows the next group to accomplish the same understanding and tasks in less time.,Assumption,Assumption,Continue
Is there a definite limit where we will reach a point where we simply can't learn any more?,Assumption,Other,None
"Possibly, however such a point is so far beyond our comprehension that we will likely go extinct as a species before we reach it.",Continue,Assumption,None
"I don't know about you, but I'm a big proponent of transhumanism.",Definition,None,None
From what I've been told by my German friend they are pretty ashamed of their involvements during WWII.,Anecdote,Anecdote,Testimony
Whereas we in the US find some pride that period.,Assumption,Assumption,Anecdote
I could be wrong but I'm fairly certain this is still a big deal.,Continue,Assumption,Continue
"&gt; More privacy

Huh?",None,None,None
In what sense?,None,None,None
You think Germans are not monitored?,None,None,None
Censorship is an issue I have with Germany.,Assumption,None,None
"GEMA for example is inexcusable institution which deprives both artists and the consumer of their rights, and no-one does jackshit about it despite everyone being pissed.",Assumption,Definition,Anecdote
Then there's the fact that the anti-Nazi obsession is so out of proportion that people are uncomfortable even discussing history.,Assumption,Assumption,Assumption
"It's embarrassing, and an immensly strong criticism I have of Germany.",Assumption,Assumption,Continue
"Any political discourse is bland and loaded with insecurity here, which is made worse by the fact that Germans suck at small talk.",Assumption,Assumption,Assumption
"I like Germany a bunch, but US beef is so much better than German beef it ought to outweigh every other factor.",Assumption,Assumption,Assumption
"Sure Germany's got less class inequality and better vacation time, but if you want a good steak you gotta go Stateside.",Assumption,Assumption,Continue
"https://en.wikipedia.org/wiki/World_Happiness_Report

Germany score is 6.994, US score is 7.104 (higher is better).",Statistics/Study,Statistics/Study,Statistics/Study
So its better to be in the US than Germany.,Assumption,Continue,Continue
I would honestly be concerned about xenophobia in Germany.,Assumption,None,Assumption
"US has xenophobic problems too but Germany seems to have more - Jews, immigrants, serious nationalism.",Assumption,Assumption,Continue
"&gt; as long as you are not rich

You mean as long as you don't reach a goal many people find worthy and spend most of their time working towards?",Assumption,Assumption,None
You exception basically excludes almost everyone and therefore weakens the utility of your point.,Assumption,Assumption,Assumption
"This whole thread goes by, and no one brings up marijuana?",None,None,None
"Granted, I hear Germany is considering, but the US is currently leading the charge into drug freedom.",Assumption,Assumption,Anecdote
"As far as my understanding goes, Germany has incredibly harsh punishments for possession.",Assumption,Assumption,Assumption
"Portugal wins on the drug front overall, but the US is certainly doing better compared to Germany.",Assumption,Assumption,Anecdote
"You make some good points but:

- worse customer service?",Assumption,Other,None
"No thanks, it's poor enough now as it is.",Continue,Assumption,Assumption
- Anti-nuclear power?,Assumption,Assumption,None
"That's just ostrich thinking, it's one of the most efficient methods there is, certainly better than fossil fuels.",Continue,Continue,Assumption
- Shops not open on Sunday?,Assumption,None,None
I'll pass.,Continue,None,None
"At best, shops should have the option, but to not allow a shop to open is silly.",Assumption,Assumption,None
Many people work Mon-Fri and the weekend is the only time they can shop.,Assumption,Assumption,Assumption
- Mandatory expensive training to get a driver's license?,Assumption,Other,None
"So, the poor can't get one?",Continue,Continue,None
"Thanks, but I'll stay in Canada.",None,Other,None
"Since apparently noone else has bothered to throw out this one point that solidly and utterly debunks your point, i will:


* 'Murica


I rest my case
[Drops mic]

Edit:

But seruously though, the ""murica"" phenomenon is a mass exercise in self deprecating humor that simultaneously recognizes americas greatness and sympathizes with the mildy anti-american sentiment commonly held by many among the international community (basically spoofing our arrogance as a way of saying that we arent hot stuff)",Assumption,None,None
- No private firearm ownership outside of clubs generally.,Assumption,None,Assumption
- Free speech less protected.,Assumption,Assumption,Assumption
- Sovereignty challenged by EU.,Assumption,Assumption,Assumption
- Germany has much lower GDP per capita.,Statistics/Study,Statistics/Study,Statistics/Study
- Germany has substantially more imports per capita.,Statistics/Study,Statistics/Study,Statistics/Study
- Germany runs a higher public debt.,Statistics/Study,Statistics/Study,Assumption
- Germany has a slightly lower HDI.,Statistics/Study,Statistics/Study,Statistics/Study
- Germany is slightly less happy per capita.,Statistics/Study,Statistics/Study,Assumption
- Germany has a larger % (all be it a small one still) of its population living under the poverty line.,Statistics/Study,Statistics/Study,Statistics/Study
- The US has higher GDP growth.,Statistics/Study,Statistics/Study,Statistics/Study
"- The US has higher population growth, and a better age demographic.",Assumption,Statistics/Study,Assumption
"To compound this, Germany has a lower fertility rate, higher death rate per 1000 people, and lower birth rate.",Statistics/Study,Statistics/Study,Statistics/Study
- The US has far less people per square mile.,Statistics/Study,Statistics/Study,Statistics/Study
- Germany is not a permanent member of the UN Security Council.,Other,Common ground,Common ground
- Slightly less people have access to the internet in Germany.,Statistics/Study,Statistics/Study,Assumption
I could go on.,None,None,None
"While much of what you say is true, it is quite clear Germany is not better in every single way *objectively*.",Assumption,Assumption,Assumption
"Late to the party, and I probably should take the time to read what everyone else wrote, but there are some quick observations.",None,None,None
"Germany may be better in some ways, but certainly not in all, even if you only look at the poor.",Assumption,None,Assumption
"One big example is the lack of Gay Marriage in Germany, compared to the US.",Assumption,Anecdote,Anecdote
There is a registered partnership which is almost but not quite the same as marriage in many but not all ways.,Assumption,Continue,Continue
"Legal, while only some parts of US have legalized recreational marijuana and the whole drug war thing is loads better in Germany than the US in general, pot is still technically illegal in Germany, even though most Germans probably live closer to places where pot is legal than most Americans.",Assumption,Assumption,Anecdote
Drivers licenses.,Assumption,None,None
In America every idiot is allowed to drive a car.,Continue,Assumption,Assumption
In Germany too but you have to be older and pay a huge amount of money for official driving lessons.,Continue,Continue,Continue
That are just a few examples of the top of my head.,None,None,None
Many countries are in many ways.,Assumption,None,Assumption
"Australia for example has less murder rates, higher standard of living, and high english/maths literacy.",Statistics/Study,Statistics/Study,Statistics/Study
"However, our culture is nearly entire derived from America &amp; Europe (slowly Asia too), since our country is young.",Assumption,Assumption,Assumption
Your content largely comes down to 'If you hold all of my values and like all the things I do with the same priorities I do then you'll like Germany better than the US.',Assumption,Assumption,Assumption
Very little of what you say has anything to do with your title claim.,Assumption,None,Continue
"Also: Germany is largely a laughingstock, considered by people to be utterly ashamed of anything resembling nationality, pride in German culture, and otherwise.",Assumption,Assumption,Assumption
"Which is one reason why demographically, Germany is not just dying, but can't even bring itself to regard said death as a bad thing.",Assumption,Continue,Continue
"There's some signs that is changing, but the very signs those are (recent political developments in reaction to refugees, etc) is something you'd apparently regard as bad news.",Assumption,Assumption,Assumption
I've heard from people that they like the open culture of the USA much more.,Assumption,Anecdote,Anecdote
"Over here the only personal exchange you have with your cashier is a simple ""hello"" and not small talk.",Assumption,Continue,Continue
Or that you will be able to talk to strangers when you go to the bar or that other people will talk to you when you go there alone.,Assumption,Continue,Continue
On the other hand I can see how people don't want that at all.,Assumption,Continue,Assumption
"FYI, smaller houses being ""objectively worse"" is silly.",Assumption,None,None
I don't want a big house.,Assumption,Anecdote,Anecdote
I have no reason to have a big house and I'd simply have to clean all the space I wasn't really using.,Assumption,Continue,Continue
I also don't want to own land I have to tend.,Assumption,Anecdote,Continue
"So you should use the phrase ""subjectively worse"" since whether it is worse or not is entirely subjective.",Definition,Continue,Continue
"Something objectively worse would be air pollution, since, theoretically, it is in no one's interest to breathe polluted air.",Continue,Assumption,Assumption
"So you say its ""free college"" but we both know thats not true because you have to pay for it in taxes.",Common ground,Assumption,Common ground
Why do you think its good to take money from individuals who know what they want and give it to the government to spend inefficiently?,Other,Other,None
the same for universal health care.,Continue,None,None
"Public transport is only ""worse"" in america because everything is more spread out.",Assumption,Assumption,Assumption
You cant get anywhere on a bus unlike germany.,Assumption,Assumption,Continue
"You say people read more and all that but do you have proof or is that just anecdotal or the ""Americans are stupid"" stereotype?",Other,Assumption,Other
"Less money in politics, can you prove it?",Other,None,Continue
