sentence,a1,a2,a3
is there less money or just less awareness?,Other,None,None
Also i dont necessarily that money in politics is bad but can you explain why specifically its so bad?,Other,None,None
You talk about how germany is more progressive and while thats not necessarily false you have to consider the area you live in the U.S.,Assumption,Assumption,Other
If you are living in the north then its basically just as progressive.,Assumption,Assumption,Assumption
Much stricter gun laws in not an objective positive.,Assumption,Assumption,Assumption
How is Rich people being less rich a positive?,Other,None,None
Can you prove that the schools are better in germany?,Other,None,None
Think of it this way there are sections and populations as big as germany that live better than germans.,Assumption,Assumption,Assumption
However because its such a large place there are lots of people bringing averages down.,Continue,Continue,Continue
"The body of your post literally disproves your title, since your title says ''in every single way'' and your body lists downsides.",Other,None,None
"Also, if we ignore your title and look at what you're *actually* asking, it's utterly silly.",Assumption,Assumption,None
Half the things being discussed are subjective.,Other,Assumption,Assumption
"You're basically telling us to disprove the sentiment

&gt;I like X better than Y

rather than something we could actually work with, like

&gt;X is better than Y

4/10 shitpost.",None,None,None
"america is about the hope of becoming the 1%, then using your wealth to bribe policymakers to become even richer.",Assumption,Assumption,Assumption
"You do not need to be rich, all you need is the dream and greed.",Assumption,Assumption,Continue
"Seriously though, some of the best specialist doctors in the world live in the US, If you have a complicated medical issue, wouldn't you want the best specialist in the world a short distance away?",Assumption,Assumption,Assumption
Not racist?,Assumption,None,None
Americans have more racial tension but are actually less racist towards each other simply due to exposure.,Continue,Assumption,Assumption
The only exposure Germans have is with Muslims.,Assumption,Assumption,Continue
"As an anecdote I'm Bengali in a major city with pretty much every race, and I have a wide variety of friends from a racial perspective.",Anecdote,Anecdote,Testimony
Europeans in general are probably more racist from what I've seen on /r/worldnews and comments on BBC Facebook posts than Americans.,Anecdote,Statistics/Study,Anecdote
They have less knowledge about racial dynamics than Americans who watch Fox News.,Continue,Assumption,Assumption
"You argue a case for Germany being better, but state yourself that it isn't in every way.",Other,None,None
"For schooling, the US university system is still the best in the world, although challenged by the poor K-12 system.",Assumption,Assumption,Assumption
"Also, homeschooling is illegal in Germany; their is no tolerance for certain types of dissent.",Assumption,Common ground,Continue
Immigration has been a huge benefit to the US throughout its history and the resulting culture is the most diverse in the world.,Assumption,Assumption,Assumption
This means that the variety of great cuisines in the US is unmatched.,Assumption,Assumption,Continue
"I'll be a bit snarky and say that likely the most world-recognized German product is beer, and the flourishing US micro/nano-brewery movement is imporving faster then the regulated German beer industry.",Assumption,Assumption,Assumption
"Finally, while Germans are generally good English speakers, it is clealy not the best place to learn the most common global language.",Assumption,Assumption,Assumption
"I'll agree with your unstated premise that the ""average"" experience may well be better for Germans, but the diversity and opportunity in the US remain unmatched.",Assumption,Assumption,Assumption
The German public treat their military terribly.,Assumption,Assumption,Assumption
They do not give them the time of day.,Continue,Assumption,Continue
I met a German soldier studying here in the US who could not believe how well American military are treated by society as a whole.,Anecdote,Anecdote,Anecdote
"As an individual, he is routinely turned down by women he has been hitting it off with, once they find out he's German military.",Continue,Continue,Continue
He says he can't run off of his instillation in Germany without someone calling him out or making a comment about him as a person and being military.,Continue,Continue,Continue
He does not advertise that he is military and would NEVER go out in public in uniform.,Continue,Continue,Continue
I would not want to live in a democracy that does not confront personal animosity towards its frontline defenders.,Assumption,Assumption,Assumption
Edit to expand and not seem so shallow: Second paragraph,None,None,None
"""Worse for Republicans, better for liberals.""",Assumption,Assumption,None
So by your own admission you've just said that Germany is worse if you're a republican.,Continue,Assumption,Assumption
That's a huge part of the US population.,Continue,Common ground,Continue
In many places in Germany you take a test in the 4th grade that determines what kind of secondary school you will go to.,Assumption,Assumption,Anecdote
"If you do well, your secondary school is on a college track, and prepares you for a white collar life.",Continue,Assumption,Continue
"If you do badly, your secondary school won't prepare or allow you to go to college.",Continue,Assumption,Continue
For developed countries it is possible to do all of those things.,Assumption,Assumption,Assumption
And most do.,Continue,Continue,Continue
"Developed countries usually have programs for the poor to afford food and water, they have environmental regulations and air quality control, public housing, universal primary and secondary education and libraries with internet access.",Assumption,Assumption,Assumption
The problem is developing countries.,Assumption,Assumption,Assumption
"They're poor, ravaged by corruption and lack stable institutions.",Continue,Continue,Continue
There's no way an African country would be able to afford such things.,Assumption,Continue,Assumption
"And even middle of the road countries (Brazil, Russia, China) have trouble providing such things because corruption is still rampant.",Assumption,Assumption,Anecdote
The problem is that the money needs to come from somewhere and it's usually the tax payer.,Assumption,Assumption,Assumption
I am not willing to up my taxes paid for anymore.,Assumption,Anecdote,Continue
The government mismanagement of funds have been going on for far too long.,Assumption,Assumption,Continue
They need to fix that and they would be able to have this program.,Assumption,Continue,Continue
"As you put in your edit, you think this will be able to be done through automation in 10-20 years.",Assumption,Assumption,None
"I agree that it could be done if automation really picks up, however my problem with this is that it takes away from a productive society, and a society that wants to make improvements.",Assumption,Assumption,Assumption
"In this system, you could choose to never work and still be fine, and have a good life overall.",Assumption,Assumption,Continue
"I mean hell, if I could get all of those things now, why even try to fight to get to the top, I could be perfectly happy with just those.",Assumption,Anecdote,Continue
"If this were to happen, innovation and drive within society as a whole would be driven down, and there is a significantly higher chance of extinction of the human race.",Assumption,Assumption,Assumption
"I do agree with you that everyone should have the right to clean air, and that we should be making conscious efforts to improve the environment so we can make Earth last a little longer.",Assumption,Other,None
You lost your entire readership as soon as you suggested internet be a basic human right.,Assumption,None,Assumption
"Doing this would require we change the legal definition of ""human"" to exclude people below a certain income bracket because they can't afford computers, phones or often even homes.",Assumption,Assumption,Continue
"What does it mean to ""have access""?",Other,None,None
Is this violated by there NOT being free food available to anyone who asks?,Continue,None,None
"If I, as a graduate student with enough of a stipend to afford the basics choose, can I elect to have the free shelter, food, and water (if no, how can you ascertain who does, without potentially removing ""access"" by those who need it)?",Other,Other,None
It would be better for humanity to focus on methods to limit reproduction rather than feeding everyone.,Assumption,Assumption,Assumption
"Once there's less people, people's labor will be more valuable and feeding themselves won't be an issue.",Assumption,Assumption,Continue
"Anything that government can give will cost money, instead of buying things for people with that money why not let people decide for themselves what they want?",Assumption,Other,None
You certainly know what you need more than any government official.,Continue,Assumption,Assumption
Give the poor money directly instead of this silly workaround.,Assumption,Other,None
"&gt; Because you need it Education

This is easy.",None,None,None
"I agree ""education"" is important, but for a government to guarantee it you must *force* others to provide it.",Assumption,Assumption,Assumption
Same with health care (although you didn't include it).,Continue,None,Continue
Essentially you're claiming a right to another's labor.,Assumption,None,Assumption
Should the government *force* a teacher to teach?,Continue,None,None
The question is: To what extent?,Other,None,None
The very bare minimum to keep people from dying on the street?,Continue,None,None
"Or a some sort of basic income that is enough for rent, food, water and internet?",Continue,None,None
"The fact is that in the end, human has personal responsibility when it comes to his own survival.",Assumption,Assumption,Assumption
"I live in a country with free education, a lot of monetary benefits, free healthcare etc.",Assumption,Anecdote,Anecdote
and it really feels like a lot of people are taking it for granted.,Continue,Continue,Continue
"I mean, many of my age or at least a bit younger don't even try to manage on their own.",Assumption,Continue,Continue
"They may have a job, but they still get hundreds of euros of benefits because, well, why not.",Assumption,Continue,Continue
"Getting benefits is the norm, not an exception.",Assumption,Continue,Continue
I believe education and healthcare should be free though.,Assumption,Other,None
"What comes to automation, I don't think it will solve much of these issues.",Assumption,Assumption,Assumption
Human individual is always responsible of himself.,Assumption,Assumption,Continue
"If human will just become a lazy fucker who gets free money while robots do everything, he's just a burden because he contributes nothing.",Assumption,Assumption,Continue
"I'm not with you on the internet, at all.",None,None,None
"The fact that life evolved and was, by many accounts, livable, before the internet, makes me think we have way too much access to the internet.",Assumption,Assumption,Assumption
It has become a dependence for most of us-I'm willing to bet that most kids high school age or younger wouldn't even know how to do a research paper without it.,Assumption,Assumption,Continue
"I have deleted Facebook and all of my iPhone games and only keep Reddit, and I find myself reading more and calling people more, and I feel happier.",Anecdote,Anecdote,Anecdote
"Sure on lots of those, but presuming a standard democratic distribution of responsibility, why should my money be forcibly taken to feed or care for another person?",Assumption,Other,None
Shouldn't that be voluntary?,Continue,Other,Common ground
"In addition, does the system you describe work and result in a net improvement in quality of life?",Other,None,None
Is it robust to outside interference?,Continue,Other,None
It seems like more homework is needed,None,Assumption,Assumption
What you have proposed has already been done.,Anecdote,Anecdote,Anecdote
It was called the Soviet Union a few decades ago.,Continue,Continue,Continue
Nowadays we call it Venezuela.,Continue,Continue,Continue
"The long and short of it is this: you'll never be able to enact and fund a system like this without coercing your citizens to labor for you, whether that means taxing them for everything they earn or just directly compelling them to work where you need.",Assumption,Assumption,Assumption
"In addition to this being *immoral* by itself, your productivity will plummet immediately (since nobody works well except for themselves) and the system will fall apart.",Assumption,Assumption,Continue
There are myriad other problems too.,Assumption,Assumption,Assumption
What kind of authority does your government need to have to command all these resources and dispense them?,Other,Other,None
Now what happens when Suddenly Trump gets control of that authority?,Other,Continue,None
What you've got here is basically Stalinism-Lite.,Assumption,Anecdote,Assumption
"It never will work, and god help us all if it's ever tried again.",Continue,Continue,Continue
"what do you do when there is a drought, famine etc?",Other,None,None
the problem with having these things as rights is that they are tangible and their existence are dependent on the environment the country is in.,Assumption,Assumption,Assumption
if you have the right to food but there is none how is your government supposed to respond?,Other,Other,Other
rights like human rights are intangible and not dependent on whether there is a drought or not.,Assumption,Assumption,Assumption
you have the right to be treated like a human being regardless of the situation.,Assumption,Assumption,Continue
"thats why things like access to food, water, etc will never be in the same ""rights"" category as other things like human rights and cannot/should not be guaranteed",Assumption,Assumption,Continue
"There are no ""rights"" guaranteed to anyone that has not been purchased with blood and/or money, and the idea that you could simply legislate all nations of the world to come to agree on any one topic is ludicrous.",Assumption,Assumption,Assumption
"Of course everyone WANTS those things, but absolutely no one is entitled to any of them.",Assumption,Assumption,Continue
"The way you say it, every person should have all of their basic needs cared for regardless of the efforts they put into acquiring them.",Assumption,Assumption,Continue
"So you are saying that I can sit on my ass all day every day, and that will be ok because I'm already going to have all of my needs cared for.",Assumption,None,None
"In all of existence, no lifeform has just had all of their needs handed to them without some trade of effort.",Assumption,Assumption,Assumption
Even the rich kids with trust funds had SOMEBODY earn the money.,Assumption,Continue,Continue
"The problem when we throw the word ""right"" around is that it is guaranteed to us regardless of others, including government.",Assumption,Assumption,Assumption
Let's think about what could entail in the grand scheme of things.,Assumption,None,Assumption
If I force government to provide me food then the government has a right to force someone to provide that food.,Continue,Assumption,Continue
"If I deserve an education from the government, then someone is forced to teach it to me.",Continue,Assumption,Continue
Same goes to mostly the rest.,Continue,Assumption,Continue
It's almost a form of legalized slavery to force others to produce something for you.,Continue,Continue,Continue
"On a practical level, I could agree with that.",None,None,None
"On a moral level, I cannot.",None,None,None
"The problem with assigning rights like that is, who provides them?",Assumption,None,Other
"If I say you have the right to freedom of speech, or your liberty, that does not require the government to give you anything at the expense of another.",Continue,Assumption,Assumption
"But shelter, food, water, medical care, those are products and services that require constant action and effort from others to produce / provide.",Assumption,Assumption,Continue
"If I say you have a right to them, does that mean you can force those professionals to provide you with their products and services for no charge?",Continue,Other,None
"The other way to do it, as is normally done in welfare systems, is through collective taxation.",Assumption,Assumption,Assumption
But that's still money being spent on you from people who were unwilling to give it to you to begin with.,Continue,Assumption,Continue
"That to me will always be morally repulsive, and so I cannot support it on those grounds.",Continue,Assumption,Continue
I can't really change your view because it depends on what you view the role of government to be in society.,None,Assumption,Assumption
What about the government guaranteeing its citizens a job?,Other,None,None
What is the cut off point where what the government is providing is unreasonable?,Other,None,None
Also what's stopping these things from being provided by the free market?,Other,None,None
"I can go out and buy food, water, shelter, and internet easily.",Assumption,Anecdote,Anecdote
Why would I need the government to provide these things when all they'll do is move money around in the form of taxation?,Continue,None,Continue
I'm also concerned with the cost.,Assumption,None,None
A system like this would be unsustainable in the long run.,Continue,Assumption,Assumption
It would just add more money to the national debt and the government doesn't have a good record of allocating money efficiently compared to a business because wasted money isn't as much of a concern to a government.,Continue,Assumption,Continue
How would the government provided internet work?,Assumption,Other,None
Will it be a government contact with a private company or a government run internet company?,Continue,Continue,None
I could see some problems with censorship if the government actually runs the internet.,Continue,Assumption,Assumption
"I think, in the United States, we have some form of government housing already for low income citizens.",Assumption,Anecdote,Anecdote
There is also homeless shelters for the extremely unfortunate.,Assumption,Continue,Continue
"I agree with you on medical care, clean air, and education though.",None,None,None
"Your original post would require a many page essay to teach you economics, so I'll spend more time rebutting your edit.",None,None,Assumption
"Ultimately, the money/wealth to afford to do provide all these handouts was generated by the free market.",Assumption,Assumption,Common ground
Social democratic programs that redistribute wealth are necessarily a drain on productivity (but arguably a necessary sacrifice to ensure people with inadequate skills or disabilities are not left to suffer).,Assumption,Assumption,Assumption
Just remember what generates wealth and what doesn't when you are trying to improve wealth distribution.,Assumption,None,None
I believe this is doable in the next two decades through automation.,Assumption,None,None
Then there's no point in arguing about it under current conditions.,Continue,None,Assumption
"&gt;Once the government builds the infrastructure to produce food for next to nothing

The *government* won't be doing this; it has always been private industry that has made goods and services more plentiful and at lower cost.",Assumption,Anecdote,Assumption
"Market forces drive down prices, not government direction/regulation (see Venezuela, for example).",Continue,Anecdote,Anecdote
"I definitely agree that governments should provide a safety net, but I'm not exactly sure what you're arguing so I have one question that applies to all the things you'd like government to guarantee.",Assumption,None,None
How much of each of these things should the government provide.,Assumption,None,None
"Food, water, and shelter are all consumable resources.",Continue,None,Common ground
If there is not enough for everyone who wants that resource how do you decide who should get what?,Other,None,None
"Respectfully, I'd like to ask you what data or statistics can you provide that leads you to believe the government can handle providing all of the services to all citizens without crashing the economy and making things worse for the citizens who have to rely on these programs.",Other,None,None
"Welfare has not solved the problem or poverty, only made it worse by subsidizing it.",Assumption,Assumption,Assumption
"Food stamps have not solved the problem of hunger, governmental housing has not solved the problem with homelessness, and the EPA is a lousy, ineffective governmental program.",Assumption,Anecdote,Assumption
"The only thing that helps the poor climb out of the lower class is upward mobility, but if we're going to tax companies to such an extent that they cannot hire as many employees, that upward mobility becomes harder to attain.",Assumption,Assumption,Assumption
"We would also have to raise taxes on the middle and lower class to pay for such programs, which would take money out of circulation and throw it towards the already bloated and irresponsible government.",Assumption,Assumption,Continue
"Not to mention we would have to overhaul our immigration system and secure all borders completely, welfare states do not survive without these things.",Assumption,Assumption,Continue
"Upward mobility should be a ladder you can climb up yourself, not a rope in which someone else pulls you up.",Assumption,Assumption,Assumption
"From an International Development standpoint, I can tell you that Internet access for everyone is not as necessary of a resource as some of the other things you listed.",Assumption,Assumption,Assumption
"In developing areas, there is no Wifi.",Assumption,Assumption,Common ground
The Internet is usually a desktop computer with an ethernet cable running to a nearby satellite dish.,Continue,Assumption,Assumption
This computer is immobile (obviously) and the connection is highly volatile.,Continue,Continue,Continue
"In many parts of the world, the Internet connection obtained with this method is too poor to do anything meaningful.",Assumption,Assumption,Continue
Just based on human nature.,Assumption,None,None
"If you could get an entire country of men to agree not to join the military; another country's military would simply invade them without hesitation

You shouldn't blame men for accepting the world they live in",Continue,Assumption,None
"Many people joined the armed forces for access to education, and I had at one point planned on joining the Navy so I could scuba dive.",Anecdote,Anecdote,Anecdote
It can be the only way of getting a higher education for some people.,Continue,Assumption,Assumption
"Well, war is essentially a war between armies/soldiers so Im not sure why you want your view to be changed as thats simply a fact.",Definition,Assumption,Assumption
If nations or other group of society would never have soldiers then there would be no fights at a scale that could be considered war.,Assumption,Assumption,Assumption
Soldiers are a needed ressource in war.,Assumption,Assumption,Assumption
"If there are no soldiers, what would stop the people of one country from simply taking land from a neighboring country?",Assumption,Other,Other
An army is just as much a deterrent to war as it is something that perpetuates war.,Continue,Assumption,Assumption
Consider watching the Dutch Army General Peter van Uhm's [TED talk about guns](https://www.youtube.com/watch?v=LjAsM1vAhW0).,Testimony,Testimony,Testimony
Here's one quote from it.,Continue,Continue,None
"(paraphrased)

&gt; Sometimes only the gun can stand between good and evil, and that is why I took up the gun.",Continue,Continue,Testimony
"Not to shoot, not to kill, not to destroy.",Continue,Continue,Continue
But to stop those who would do evil.,Continue,Continue,Continue
To protect the vulnerable.,Continue,Continue,Continue
To defend democratic values.,Continue,Continue,Continue
I agree with your view to an extent.,None,None,None
"However, you are light years ahead of where we need to be as a species before we no longer need armies.",Assumption,Assumption,Assumption
"If we can survive this era of humanity, I do believe we'll evolve into a peaceful species.",Assumption,Assumption,Assumption
But we're talking thousands of years from now.,Continue,Assumption,Continue
Humans still have violent instincts.,Assumption,Assumption,Assumption
We're too close to our animalistic behavior to not have the inherent desire to fight and conquer and win and collect.,Continue,Assumption,Continue
"The fact is, as there is overwhelming evidence, the toughest, most violent people will fill voids of power.",Assumption,Assumption,Assumption
"Where there isn't a governed region, someone will find a way to control the people in the region through use of violence.",Assumption,Assumption,Continue
"I think an important step is developing a good ""soft"" military... Intelligence officers, engineers, military strategists, etc.",Assumption,Assumption,Assumption
"Having a strong soft military will lessen the need for what you describe as ""killing machines"".",Assumption,Assumption,Continue
Most of the people will simply have to understand how complex weaponry works and push a button.,Assumption,Assumption,Continue
"The good news is, despite what the media tells you, we are living during one of the most peaceful eras in history.",None,Assumption,Assumption
I have hope that we'll continue the path and eventually evolve into a totally non-violent society.,None,Assumption,None
"Incidentally, history suggests that millions of soldiers losing their jobs all at once would not be economically harmful.",Anecdote,Anecdote,Anecdote
