sentence,a1,a2,a3
"We tried it after World War II, and the results were [quite positive](https://en.wikipedia.org/wiki/Post%E2%80%93World_War_II_economic_expansion).",Continue,Continue,Continue
There are many reasons besides liking war that people enlist.,Assumption,Assumption,Assumption
I kinda had to say that to abide by the rules.,None,None,None
Here is something I found interesting today.,None,Testimony,None
"Reading an article about a scientist who has discovered how to trigger limbs and eyes to regrow in on the left or right side of some animals, and the article pointed out how this could be used to regrow a soldiers arm that got blown off.",Testimony,Continue,None
"I know this is not why they do it, but my first thought was "" Really?",None,None,None
"we want to be able to regrow limbs so we can continue this cycle of endless war? """,None,None,None
a world without soldiers would not be peaceful.,Assumption,Assumption,Assumption
"Soldiers are tools used by governments to perpetuate agendas, as a diplomatic threat and a method of enforcing those agendas upon unwilling governments, organizations, and peoples.",Definition,Assumption,Continue
"If governments did not have people to use as that tool, they would use something else.",Assumption,Assumption,Continue
"Machines, drones, NBCs, bombs, whatever comes to hand.",Continue,Continue,Continue
I'm also going to disagree with your statement that most soldiers join to serve the country.,None,None,None
"At least in America, despite our idolization of patriotism, most soldiers (in my experience) join for personal benefit.",Anecdote,Anecdote,Anecdote
"College money, steady employment, free Healthcare, etc etc.",Continue,Continue,Continue
"I think the thing you have to consider is that if a country disbands, decreases, or loses it's army, it creates a vacuum.",Assumption,Assumption,Assumption
"When this happens, some other armed force will inevitably fill that void, and it's usually not the armed force you'd like.",Continue,Continue,Continue
"Potentially drug lords, terrorist organizations, etc.",Continue,Continue,Continue
One example of this would be ISIS.,Anecdote,Anecdote,Anecdote
The failed state(s) in which ISIS operate provide an opportunity to seize control and execute their own agenda.,Continue,Continue,Continue
"Brazil faces similar problems, and one could make an argument that parts of Chicago have similar circumstances.",Anecdote,Continue,Anecdote
"The fact of the matter is, humans are creatures of war.",Assumption,Assumption,Assumption
"Even if every country decided to lay down their arms, someone would be along shortly to pick them up.",Assumption,Continue,Continue
Soldiers are respected for their willingness to die for their cause.,Assumption,Assumption,Assumption
"The point is, if all the soldiers were gone, you're left with dealing with people who are willing to die for their cause having all of the power.",Assumption,Assumption,Continue
You're happy with your life and don't have people willing to die to protect that way of life?,Assumption,Assumption,Assumption
"Guess what, me and my friends who are willing, or maybe even just reckless, now own your place and I'll decide whether or not you get to persist with your happy society.",Continue,Anecdote,Continue
"Civilization is a facade of safety against nature's monsters, and the monsters that humans tend to be towards each other, a comforting white lie, predicated on the idea that there are people willing and able to commit violence on the less able or willing's, behalf.",Assumption,Assumption,Assumption
Professional performers of violence are a necessary evil for a safe society.,Assumption,Continue,Assumption
It's a prisoner's dilemma.,Assumption,None,Assumption
"Sure, if nobody serves in any military then we end up with the best possible world- no war.",Continue,Assumption,Continue
"However, if someone breaks that ideal and joins up, or more likely someone is forced to fight, then the country without the army suffers immensely.",Assumption,Assumption,Continue
"So the safest bet, when you don't have any guarantee of cooperation from a third party, is to make an army and take the increase in violence and war that comes with it.",Assumption,Assumption,Continue
Not all soldiers go to war.,Common ground,Assumption,Assumption
Not all wars are fought by soldiers.,Common ground,Assumption,Assumption
Wars are rarely started by the people you consider soldiers.,Common ground,Assumption,Assumption
The first person who decides to act as a soldier (in a much broader sense than your nationalistic definition of soldier) enables war but additional soldiers do not necessarily perpetuate it.,Assumption,Assumption,Assumption
"In fact, without an opposing force wars would have less reason to stop.",Assumption,Assumption,Continue
Some soldiers end wars that would have continued otherwise.,Assumption,Assumption,Assumption
Responsibility lies with those responsible and soldiers are not necessarily part of that group.,Assumption,Assumption,Assumption
Your view is not applicable to all soldiers.,None,Assumption,Assumption
Soldiers can exist without war and war can exist without soldiers.,Assumption,Continue,Continue
War is much more complicated than that and eradicating it would require a greater fundamental change than even your admittedly impossible desire.,Assumption,Continue,Continue
"Seeing the time stamps on a lot of these, I'm probably too late.",None,None,None
But here goes!,None,None,None
"Your view is one of many in a greater debate about the fundamental nature of mankind: If civilization were removed - with its national pride and drive for resources taken with it - would mankind be peaceful, or violent?",Assumption,Other,None
"Unfortunately, the question itself is moot; whether or not mankind as a whole were peaceful is irrelevant because there only needs to be violent individuals, few and far between, to trigger cycles of violence.",Assumption,Assumption,Assumption
These violent individuals will have to be met with violence in order to insure the survival of the whole.,Assumption,Continue,Continue
"One this has happened, it is no longer just these individuals who must be considered violent; it is the home.",Assumption,Continue,Continue
TL,Assumption,Assumption,Continue
"So, if country A does not have a military, only police, and country B *does* have a military, country B *will* exploit the situation.",Anecdote,Assumption,Assumption
History shows this happens time and time again.,Continue,Anecdote,Continue
"Until a global order is established, countries will compete for resources.",Assumption,Continue,Assumption
"This competition sometimes delves into violence, because that is a fundamental aspect of our species.",Assumption,Continue,Continue
"Hopefully, we will eventually evolve out of it.",None,None,Continue
"In the meantime, we have not, and war is guaranteed to exist somewhere in the world.",Assumption,Assumption,Continue
"Following this model, volunteering to serve doesn't make you a perpetrator of war - only a participant in something that would be happening whether you were there or not.",Assumption,Assumption,Assumption
"Global peace will be a consequence of a shift in philosophy and emotional maturity by the entire species over time, not the actions or inactions of a single person.",Assumption,Assumption,Continue
Agree.,None,None,None
"I accept that standing militaries are necessary, but in the same way that death penalty executioners are.",Assumption,None,None
"We aren't calling those people heroes and victims constantly, so why would we pander so hard to these volunteers?",Assumption,Other,Other
They're just federal workers choosing to do an ugly job and getting paid well for it.,Assumption,Assumption,Continue
 Enough with the propaganda telling us to call them heroes and victims constantly.,Assumption,None,None
"Firstly you must recognise that war is almost inevitable, as wars are typically won by the countries that fight.",Assumption,Assumption,Assumption
"Secondly, until we develop a low cost robot army, wars will be fought with people.",Assumption,Assumption,Assumption
"If people are unwilling to fight for their country in such large quantities that their country faces a large disadvantage in war, that country must resort to policies such as conscription.",Assumption,Assumption,Continue
"In a way, those willing to sign up are protecting your rights to live freely as a civilian, by allowing your country to continue to recruit only volunteers.",Assumption,Assumption,Assumption
It takes only one warmonger to take over every peaceful nation in the world.,Assumption,Assumption,Assumption
"It is very much dependent on the choice of the leaders of the military, not the members, that perpetuates or discourages war and violence.",Assumption,Assumption,Assumption
"Considering the current state of our world, having some ability for a country to defend itself is a necessity because right now it is just a fact that enough extremism exists to warrant a military.",Assumption,Other,Assumption
"In a similar way, if you worked in a fast food chain when you're in highschool, were you perpetuating obesity?",Assumption,Assumption,Other
Your argument could further be carried over towards police as well since they are arguably perpetrator of violence.,Assumption,Assumption,Assumption
"As soon as we start to remove the powers which use violence to protect, regardless of whether that's all they use it for or not, people will begin to take advantage of the lack of enforcement and remind us why we had soldiers serving in the first place.",Assumption,None,Assumption
"I'm noticing that I'm getting downvoted for my opinions in some of my replies (except the ""never said anything about policemen"" one, my bad).",None,None,None
"I'd be a lot more open-minded if i wasn't just being downvoted for having a controversial opinion, thanks.",None,None,None
I think your view is unfairly blaming soldiers for war.,Assumption,None,None
You say without soldiers there would be peace and ascribe this to the absence of men fighting.,Assumption,None,None
So is your ultimate problem with war or soldiers?,None,Assumption,None
War could just as easily be waged with human killing robots (e.g.,Assumption,Continue,Assumption
Drones).,Continue,Common ground,Continue
Soldiers have signed up for duty to serve their countries during times of peace.,Assumption,Assumption,Assumption
"They are instruments of war, not the cause; and therefore should not be blamed for it.",Assumption,None,Continue
You should look into realist theory in international relations.,Definition,None,Testimony
While not applicable to every situation it gives great insight into why nations fight.,Continue,Assumption,Continue
"Simply put, even if you eliminate every soldier from the equation the uncertainty of what your neighbor is doing would likely spark conflict anyway.",Continue,Continue,Assumption
You don't need soldiers to fight one another.,Continue,Testimony,Continue
"As Thomas Hobbes said in Leviathan, for every neck there are two hands to strangle it.",Testimony,None,Testimony
I'd recommend checking out Mearschimer's book The Tragedy of Great Power Politics.,Testimony,None,Testimony
"It's not exactly a happy book, but maybe it could shed some light on why nations pursue conflict with each other.",Continue,Assumption,Continue
What I really want to get at is that removing soldiers wouldn't necessarily reduce conflict.,Assumption,Assumption,Assumption
Who do you think makes all that equipment that the military uses?,Other,Continue,None
Or who do you think funds it?,Continue,Continue,None
"Its the entire nation's citizens that go to war, not just their military.",Assumption,None,Common ground
"Your view doesn't make any sense, because the idea of a standing army is not an artificial construct.",Assumption,Assumption,Assumption
It's simply militias and mercenaries on a national scale.,Assumption,Continue,Continue
It doesn't make any sense to say that soldiers would cease to exist.,Assumption,Continue,Continue
"The weapons would still be there, yeah?",Other,Continue,Other
"Someone who uses those weapons would be the new ""soldier"".",Assumption,Assumption,Continue
"Soldiers, just like all humans, can be exploited for good or bad ends.",Assumption,Assumption,Assumption
Blaming soldiers for war because they fight in it is no different from blaming taxpayers for war because they fund it.,Assumption,Continue,Continue
"Which is to say, it's silly.",Continue,Assumption,Continue
"If I rent a locker in a self-storage facility to run a newspaper out of it, I'll get kicked out.",Assumption,Assumption,Assumption
"I'm not being 'censored' by the owner of the storage facility, I'm simply violating the rules I had to agree to to get the locker in the first place.",Assumption,Continue,Continue
"If the rules for renting a ""locker"" to host my website on someone else's server include ""you can't promote being a Nazi"" and then I promote being a Nazi, I'm going to get kicked off.",Assumption,Continue,Continue
I've read through your comments here.,None,None,None
"It seems to me that you are of the opinion that web hosting is a resource that people should be free to use however they please as long as they can afford it, and anything else is censorship.",Assumption,Assumption,None
That isn't true.,Continue,Continue,None
The companies that host have complete and ultimate discretion over what they are comfortable having on their servers.,Assumption,Assumption,Assumption
It isn't that hard to set up your own server - I'm sure there are some Nazi IT guys out there that would be thrilled to help the cause.,Assumption,Assumption,Assumption
Google and GoDaddy are NOT hosting services (that these people were using).,Definition,Assumption,None
"They were using them as DNS registrars meaning Google and GoDaddy didn't ban the websites themselves, just made it more difficult to find them.",Continue,Assumption,None
"However, Google and GoDaddy are private companies that work through ICANN to officially register domains.",Definition,None,None
You can't go directly to ICANN to register a domain but anyone can register with ICANN to become their own registrar.,Continue,None,None
"This means if the Daily Stormed wanted to, they could register their DNS themselves and ICANN would reserve the space for them without protest.",Continue,Assumption,Assumption
"It would (likely) become legally grey (if not illegal) if DNS services like Google, OpenDNS, ISP DNS, etc didn't recognize the domain after it was officially recognized by ICANN.",Assumption,Assumption,Continue
That can be argued as censoring the internet.,Continue,None,Continue
The response of the private companies is in line with the general public opinion of white supremacy and naziism.,Assumption,Assumption,None
These private companies are still made up of people that are part of the general public.,Assumption,Assumption,None
"There might be some slight decoupling of the two, but they're probably not gonna start banning whatever they feel like.",Assumption,Assumption,Assumption
"If they did, it's not unreasonable to expect public opinion to turn against them.",Continue,Assumption,Continue
"I get what you're saying, slippery slope and all.",Assumption,None,None
"But they're not gonna just start censoring randomly, their priority is the bottom line.",Assumption,Assumption,Assumption
"If enough people don't care, they won't.",Assumption,Continue,Continue
"Pretty simple here, everyone gets to choose what they advertise/publish.",Assumption,None,None
Coke can't force you to take off your Pepsi shirt for the sake of fairness.,Anecdote,Assumption,Assumption
Nor can porn stars force youtube to distribute their videos.,Anecdote,Assumption,Continue
"Protecting people's right NOT to speak is also incredibly important, it's why we have the fifth ammendment, for example.",Assumption,Assumption,Common ground
No one should force Google to catalog nazi shit if Google doesn't want to.,Assumption,Other,None
"Likewise, why should godaddy have to deal with the social fallout from hosting those sites if they don't want to?",Other,Other,Other
"Okay this just seems like you just want to vent about leftists and obama more than have an actual discussion about this at times dude 

The problem is that these groups IMPLY violence even when they dont directly threaten it, and thats where it becomes problematic.",Assumption,Assumption,Assumption
The Donald talking about throwing people out of helicopters?,Anecdote,None,None
Or supporting people who run over protesters?,Continue,None,None
These things rapidly bubble up to actual violence and the normalization of violence.,Continue,Assumption,Assumption
"Even the 'punching nazis' thing is about as far as the left goes with this kind of stuff, on the right?",Assumption,Other,None
I hear... much worse.,Continue,None,None
"Also because we know history, and we know how poisonous fascism can be to people.",Common ground,None,Common ground
It is dangerously easy.,Assumption,None,Continue
"Even Hitler himself said there is no dealing with us, no talking, you cannot beat us by discussion, you have to defeat us at our very core, before we even take hold.",Anecdote,Anecdote,Anecdote
And his words have rung true with EVERY authoritarian or fascist movement in history.,Continue,Continue,Continue
There is no arguing with these people.,Assumption,Assumption,None
History has proven this time and time again.,Continue,Anecdote,Anecdote
"If you want to have a reasonable discussion, you can have it, but if you start advocating white supremacy and fascism... you're too far gone, and you probably dont belong in society.",Assumption,Assumption,Assumption
False.,None,None,None
"If they pooled together their own money, they could set up servers, and lease internet connections and run their own websites.",Assumption,Assumption,Assumption
Private companies aren't the only way to have a website on the internet.,Assumption,Assumption,None
"They may even have some members that are familiar with web design, if they don't their own members could buy the books/watch youtube and learn.",Assumption,Assumption,Assumption
UNLESS... we get rid of net neutrality.,Assumption,None,Continue
"Then local ISP's could filter that content out for the groups not being able to pay to access you as a customer, even if they had set up their own website hosting service.",Continue,Continue,Continue
"You cut out a lot of meat here: many of these sites and people are being ""censured"" because a lot of what they call for is either against the terms of agreement or the simple rules.",Assumption,Assumption,Assumption
"Rules like talking about genocide or killing people or wiping out an entire race might seem blasé because we haven't dealt with it, and it seems like some 12-year-old ranting on XBOX, but these are very much active threats.",Assumption,Continue,Assumption
"In the wake of real incidents, these views are being taken much more seriously.",Continue,Continue,None
"That's not really ""an opinion"" anymore than ""I'm going to a take a sip of coffee"".",Assumption,None,None
"It's a statement, or declaration.",Continue,None,None
It depends on whether or not it advocates violence.,Assumption,None,None
"If someone says ""fuck the Jews, someone should go kill them"" or implies that meaning strongly then they lose that right.",Assumption,None,Assumption
Free speech stops at the point where it endangers someone else's safety.,Assumption,Definition,Continue
They were kicked off because they wrote an article glorifying a terrorist and insulting his victims.,Assumption,Assumption,None
"If anyone else was glorifying terrorists that killed American citizens, and an American company was still giving them services to spread their propaganda, everyone would be asking what the hell they were doing.",Assumption,Assumption,Assumption
Why bring up executive orders by Obama?,Other,None,None
"Besides the fact that Obama signed on average fewer executive orders per full term than any past president going back to Grover Cleveland, what does this have to do with your issue?",Other,Anecdote,None
"&gt; If we ban things we don't like we will end up with only the most popular ideas allowed  

I don't think they are banning things they don't like, they are banning something harmful and dangerous.",Assumption,Assumption,Assumption
"Some people say that guns don't kill people, people kill people.",Assumption,None,None
"But hate ideologies cause wars, terrorism and stop the civilisation process.",Assumption,Assumption,Assumption
"This is not censoring someone that says ""I don't like jews"", it's agreeing on a widespread consensus that ideologies that encourage violence will not be tolerated, whether it's because Allah, Christ, nationality, race, gender, sexual preference or any other basis.",Assumption,Assumption,Continue
"So, they are not banning neo-nazi people or even opinions, they are banning violence encouragement and this is fine by me.",Assumption,Continue,None
"When the #1 thing on your list of political priorities is harming a group based on their race, your peaceful protest still stands for violence.",Assumption,Assumption,None
"So you can say, ""nobody's speech mentioned extermination of Jews or blacks.""",Continue,Continue,Assumption
"My response is, ""yeah, but your t-shirt, and the flag you're holding, and the tattoo on your bare chest all say ""death to Jews.""",Assumption,Assumption,Continue
"When you've make violence your #1 priority and all other social and economic points a secondary priority, you don't get to enjoy free speech.",Assumption,Assumption,Assumption
It was one thing that the general alt-right is racist (they are absolutely racist btw.,Assumption,None,None
"Their whole purpose to to gain political power by appealing specifically to white people in order to create a nationalistic, conservative government that excludes outsiders) but didn't overtly advocate for racist policy and it's another when you give nazis a bully pulpit to call for the murder of an entire group of people.",Assumption,Assumption,None
"They aren't making these as laws, these are people going out of their way to prevent these sort of groups.",Assumption,Assumption,None
GoDaddy most likely removed them from their domain in order to keep a good reputation.,Assumption,Assumption,Assumption
"They aren't trying to take their freedom of speech away, they are just reminding people that freedom of speech can also have consequences.",Assumption,Assumption,None
"So they aren't facing legal problems like being arrested or sued, they are facing more social consequences like the rest of the country hating them.",Continue,Assumption,None
So I'm all for the free market of ideas and letting better ideas like tolerance trounce hate but I don't think it's unfair to criticize companies like godaddy from dumping stuff they don't support from their servers.,Assumption,Assumption,None
"Godaddy should be able to choose who uses their business and if they don't want people putting content they don't support on their servers, they have the right to drop them",Assumption,Other,None
No has the 'freedom' to incite violence.,Assumption,Assumption,None
That is not protected speech.,Continue,Continue,None
That's why they lost their website.,Continue,Continue,None
"The host's rules against encouraging hate and violence mirror our societies rules on free speech, they are not in opposition to them.",Assumption,Definition,Assumption
"For over a decade, we've been taking down private sites that host  content and discussions produced by Sunni Islamic extremists.",Anecdote,Assumption,Anecdote
"The reason was that the speech contained on the sites incited violence, radicalized visitors and allowed extremists to organize and plot attacks.",Continue,Assumption,Continue
The sites would radicalize those who wouldn't become violent under normal circumstances.,Assumption,Assumption,Continue
"Now that it is 2017, Twitter, Facebook and Google all have divisions dedicated to analyzing, removing and reporting Islamic extremist content.",Anecdote,Anecdote,None
There are companies that monitor and infiltrate Islamic extremist networks.,Continue,Continue,None
"The neo-Nazi site in question was glorifying a terrorist, championing his means/cause and shaming his victims.",Assumption,Assumption,None
The neo-Nazi site was no different than the Islamic extremist websites that post pictures of successful terror attacks while exalting the perpetrators.,Assumption,Assumption,None
It's private enterprise doing what it wants.,Assumption,Assumption,None
Who are we to force them to transact with a group they don't want to transact with?,Continue,Other,Other
Why infringe on their rights?,Continue,Continue,Continue
If people want to freely not engage with these shitlords then let them.,Continue,Continue,Continue
Your point of it being legal to discriminate towards POCs in the 1900s is not a fact of today,Assumption,Assumption,None
Are there other factors as into why it may be harder for them to get housing?,Other,None,None
"This is like saying, ""I should be able to have my own TV show on NBC"".",Assumption,Assumption,None
"They are not, nor should be entitled to that.",Assumption,Assumption,None
"Now, if they raise enough money to start their own network, buy their own spectrum, and comply with FCC mandates, then they can have their TV show, and that show is protected by law as long as it is in compliance with law.",Continue,Definition,Assumption
I think that the real interesting question will be if this delisting from Google and Godaddy will have legal consequences for them.,Assumption,None,Assumption
"Because as far as I understand these have ISP protections that they will let all traffic through, and do not monitor or regulate the content.",Continue,Assumption,Continue
